{"schema_version":1,"reviewer":"delivery_reviewer","overall_summary":"The speech has a clear delivery target: AI-era tests should function as a stable gate, not as vague reassurance. The opening and closing are relatively strong because they speak to the audience directly and end with a concrete action. The main delivery risk is the middle: generic transitions, repeated pronouns, and visible sentence repair make listeners reconstruct how each example supports the central point.","filler_annotations":[{"annotation_id":"f001","token_ids":["t0080"],"surface":"이제","label":"filler","confidence":0.78,"evidence_quote":"그렇다면 이제 판정, 테스트 코드가 있다면","reason":"Here \"이제\" does not add time meaning; it works as a planning bridge before the next concept."},{"annotation_id":"f002","token_ids":["t0113"],"surface":"이제","label":"filler","confidence":0.82,"evidence_quote":"주어진 입력에 대해서 이제 동작을 보장한다는","reason":"The word interrupts the definition and functions as a non-semantic verbal pause."},{"annotation_id":"f003","token_ids":["t0224"],"surface":"아니","label":"filler","confidence":0.86,"evidence_quote":"Ai에게 테스트, 아니 이 코드를 평가를","reason":"This is a repair marker replacing the previous phrase, not a semantic negation."},{"annotation_id":"f004","token_ids":["t0374"],"surface":"아","label":"lexical","confidence":0.62,"evidence_quote":"내가 딱 이걸 봤을 때 아 이거는 그래도","reason":"This appears to represent an internal realization being quoted, so it is not clearly a hesitation filler."}],"findings":[{"criterion":"filler_and_disfluency","status":"caution","evidence":[{"token_ids":["t0080","t0081","t0082","t0083"],"quote":"이제 판정, 테스트 코드가"},{"token_ids":["t0110","t0111","t0112","t0113","t0114","t0115"],"quote":"주어진 입력에 대해서 이제 동작을 보장한다는"},{"token_ids":["t0222","t0223","t0224","t0225","t0226","t0227"],"quote":"Ai에게 테스트, 아니 이 코드를 평가를"}],"diagnosis":"Fillers are not constant across the whole transcript, but they appear at important definition and example-entry moments. The repair at the refund example makes the setup sound improvised.","impact":"Listeners may hear the speaker searching for the next route exactly when they need clean signposts.","action":"Rehearse the pivot sentences around \"판정\", \"초록의 의미\", and \"예시\" with a silent pause before each pivot instead of filling the gap."},{"criterion":"pace_and_pause","status":"not_evaluable","evidence":[{"token_ids":["t0006","t0007"],"quote":"总时长:           5分钟25秒"}],"diagnosis":"The context provides overall duration and an overall metric of 96.92 whitespace tokens per minute, but segment_pace is empty and the transcript does not preserve pause lengths.","impact":"I cannot responsibly judge rushing, dragging, or ineffective pauses from the available evidence.","action":"For the next review, provide segment-level pace or audio-derived pause timestamps so pace can be diagnosed separately from wording."},{"criterion":"verbal_style","status":"problem","evidence":[{"token_ids":["t0130","t0131","t0132","t0133","t0134","t0135","t0136","t0137","t0138","t0139","t0140","t0141","t0142","t0143","t0144","t0145","t0146","t0147","t0148","t0149","t0150","t0151","t0152","t0153","t0154","t0155"],"quote":"사각지대는 언제든 나올 수 있습니다. 중간에 내가 작업을 하다 생각날 수도 있고 맞은 케이스가 혹은 다른 서드 파티 나 라이브러리 업데이트에서 갑자기 에러가 생길 수도 있고"},{"token_ids":["t0364","t0365","t0366","t0367","t0368","t0369","t0370","t0371","t0372","t0373","t0374","t0375","t0376","t0377","t0378","t0379","t0380","t0381","t0382","t0383"],"quote":"이처럼 계속 바뀌지 않고 이것이 내가 딱 이걸 봤을 때 아 이거는 그래도 이거에 대해서는 되게 정확히 동작한다 동작을 보장한다"}],"diagnosis":"The delivery relies heavily on broad referents like \"이것\", \"그것\", and \"그런 것들\", plus stacked clauses ending in repeated \"수도 있고\" patterns.","impact":"The listener has to infer which object is being discussed: test code, test input, AI evaluation, coverage, or the gate itself.","action":"Replace vague referents at key points with the noun you mean, especially \"테스트 입력\", \"초록 결과\", \"판정 기준\", and \"사각지대\"."},{"criterion":"opening","status":"good","evidence":[{"token_ids":["t0017","t0018","t0019","t0020","t0021","t0022","t0023","t0024"],"quote":"안녕하세요. AI 시대의 테스트에 대해서 설명을 해보려고 합니다."},{"token_ids":["t0038","t0039","t0040","t0041","t0042","t0043","t0044","t0045","t0046","t0047","t0048","t0049"],"quote":"근데 테스트가 있다고 정말 안전한 걸까요? 여러분들의 테스트는 어떤 걸 하고 있나요?"},{"token_ids":["t0057","t0058","t0059","t0060","t0061","t0062","t0063","t0064","t0065","t0066","t0067","t0068","t0069"],"quote":"Ai가 3분만에 500줄을 내고 1000줄을 냈는데 그 줄들을 테스트가 전부 보장을 하는 건가요?"}],"diagnosis":"The opening quickly names the topic and frames a real audience concern: AI-generated code and whether tests actually guarantee behavior.","impact":"The listener gets a practical reason to listen before the speaker enters definitions or examples.","action":"Keep the audience-question opening, but end it with the central gate sentence so the following sections have a stronger anchor."},{"criterion":"core_message","status":"caution","evidence":[{"token_ids":["t0350","t0351","t0352","t0353","t0354","t0355","t0356","t0357","t0358","t0359","t0360","t0361","t0362","t0363"],"quote":"결론적으로 테스트란 것은 먼저 인상으로 결정한 것이 아니라 흔들리지 않는 절대적 게이트라는 것이 중요합니다."},{"token_ids":["t0413","t0414","t0415","t0416","t0417","t0418","t0419","t0420","t0421","t0422","t0423","t0424","t0425","t0426","t0427","t0428","t0429","t0430","t0431","t0432","t0433","t0434","t0435","t0436","t0437","t0438","t0439","t0440","t0441","t0442","t0443","t0444","t0445"],"quote":"그래서 테스트 코드가 그냥 단순히 있는 게 아니라 가장 중요한 것은 이것을 통과하는 입력이 어떤 것인지 이것이 정말 어떤 것을 보장하는 것인지 이 테스트가 그냥 잘못된 것은 아닌지 그런 것이 더 중요하다고 생각합니다."}],"diagnosis":"The central message is identifiable, especially in the latter half, but it arrives after several question chains and example fragments.","impact":"A listener may understand the thesis only retrospectively rather than using it to organize the whole speech from the beginning.","action":"Move the \"흔들리지 않는 게이트\" message into the first minute, then use each example as proof of that one sentence."},{"criterion":"development_and_transitions","status":"problem","evidence":[{"token_ids":["t0076","t0077","t0078","t0079","t0080","t0081","t0082","t0083","t0084","t0085","t0086","t0087"],"quote":"항상 흔들리게 되죠. 그렇다면 이제 판정, 테스트 코드가 있다면 그것은 괜찮은 건가요?"},{"token_ids":["t0199","t0200","t0201","t0202","t0203","t0204","t0205","t0206","t0207","t0208","t0209","t0210","t0211","t0212","t0213","t0214","t0215","t0216","t0217","t0218"],"quote":"이들을 테스트가 전부 다 막을 수 있을까요? 예를 들어보죠. 환불 도메인에서 제가 Ai에게 테스트 코드를 짜달라고 하고 그 평가를 맡겨보았습니다."},{"token_ids":["t0273","t0274","t0275","t0276","t0277","t0278","t0279","t0280","t0281","t0282","t0283","t0284","t0285","t0286","t0287","t0288","t0289","t0290"],"quote":"하지만 초록이 항상 옳았냐? 그건 아닙니다. 이 테스트가. 예를 들어서 제 일할계산 부분이 테스트 케이스로 커버리지가 되어 있었지만"}],"diagnosis":"Transitions use broad words like \"그렇다면\", \"이들을\", and \"하지만\" without always stating the relationship between the previous claim and the next example.","impact":"The audience has to reconstruct why AI evaluation, 18 acceptance tests, coverage, rounding, and defect injection belong to the same argument.","action":"Before each example, say which claim it proves: instability of impression, limited meaning of green, or remaining blind spots."},{"criterion":"closing","status":"good","evidence":[{"token_ids":["t0457","t0458","t0459","t0460","t0461","t0462","t0463","t0464","t0465","t0466","t0467","t0468"],"quote":"테스트 코드가 있다면 초록인 테스트 코드를 하나 골라서 부등호 하나를 집어보는 겁니다."},{"token_ids":["t0476","t0477","t0478","t0479","t0480","t0481","t0482","t0483","t0484","t0485","t0486","t0487","t0488","t0489","t0490","t0491","t0492","t0493"],"quote":"그렇다면 그 코드가 계속 초록이라면 당신은 정말 쓸모없는 테스트 코드를 하나 버려낼 수 있고 그 테스트가 빨강으로 변했다면"},{"token_ids":["t0512","t0513","t0514","t0515","t0516","t0517","t0518"],"quote":"당신은 진정한 게이트를 얻을 수 있는 것입니다."}],"diagnosis":"The close gives a concrete next action and retrieves the gate idea from the core message.","impact":"The listener leaves with a practical rehearsal-friendly behavior, not just a general belief that tests matter.","action":"Keep the closing action, but cleanly articulate the final sentence before \"감사합니다\" so the last takeaway is not blurred by the garbled phrase at t0510-t0511."}],"top_actions":["Move the central gate sentence into the opening so listeners have one anchor before the examples begin.","Add explicit signposts before each example: which claim the example proves and what the listener should notice.","Replace vague referents like \"이것\", \"그것\", and \"그런 것들\" with concrete nouns at definition and transition points."],"limitations":["No audio was provided, so pitch, volume, emphasis, confidence, emotion, and audience reaction were not evaluated.","segment_pace is empty, so pace and pause quality could not be responsibly diagnosed.","The transcript appears machine-generated and contains possible recognition errors such as \"인스테스트\" and \"일부는 투자여\"."]}
